{
  "schema_version": "1.0.0",
  "event_id": "hp-sim-001-000003-b18e2238",
  "device": {
    "device_id": "hp-sim-001",
    "firmware_version": "sim-py-0.1.0",
    "hardware_revision": "none-simulation"
  },
  "source": {
    "mode": "simulation",
    "scenario": "motor_stall",
    "seed": 1,
    "ground_truth_label": "bite_then_motor_stall",
    "generator": "hookpilot-synth-v1",
    "label": "SIMULATION"
  },
  "timestamp": {
    "start_utc": "2026-01-01T00:00:30.000Z",
    "end_utc": "2026-01-01T00:00:38.000Z",
    "monotonic_ms": 30000,
    "clock_quality": "host_clock_simulated"
  },
  "calibration": {
    "calibration_version": "sim-identity-v0",
    "scale_n_per_count": 1.0,
    "offset_counts": 0.0,
    "calibrated_utc": null
  },
  "sensor_data": {
    "sample_rate_hz": 50.0,
    "units": "N",
    "raw_data_ref": null,
    "raw_data_sha256": null,
    "samples": [
      [
        0.0,
        0.44210329257016884
      ],
      [
        20.0,
        0.459438061098401
      ],
      [
        40.0,
        0.44448014816835996
      ],
      [
        60.0,
        0.4054975889356131
      ],
      [
        80.0,
        0.407422829296048
      ],
      [
        100.0,
        0.44080720974824167
      ],
      [
        120.0,
        0.47915648785438364
      ],
      [
        140.0,
        0.4220763584948568
      ],
      [
        160.0,
        0.4403303131751391
      ],
      [
        180.0,
        0.4246444410701704
      ],
      [
        200.0,
        0.44522758428768067
      ],
      [
        220.0,
        0.4374737657079035
      ],
      [
        240.0,
        0.44727545417948705
      ],
      [
        260.0,
        0.444201326727615
      ],
      [
        280.0,
        0.4525829650960992
      ],
      [
        300.0,
        0.418367058392794
      ],
      [
        320.0,
        0.4633022959108638
      ],
      [
        340.0,
        0.4298653659975385
      ],
      [
        360.0,
        0.44032593221696403
      ],
      [
        380.0,
        0.40869370811359423
      ],
      [
        400.0,
        0.44483670526396385
      ],
      [
        420.0,
        0.44348284644931346
      ],
      [
        440.0,
        0.4353390236925074
      ],
      [
        460.0,
        0.46094299064853156
      ],
      [
        480.0,
        0.4412488570219063
      ],
      [
        500.0,
        0.4482230081937453
      ],
      [
        520.0,
        0.44961796546486016
      ],
      [
        540.0,
        0.4785664266863138
      ],
      [
        560.0,
        0.4670229671524624
      ],
      [
        580.0,
        0.4654112451969774
      ],
      [
        600.0,
        0.45246993505540145
      ],
      [
        620.0,
        0.46082918041533827
      ],
      [
        640.0,
        0.4839277557689786
      ],
      [
        660.0,
        0.4149617350041245
      ],
      [
        680.0,
        0.4103942619078573
      ],
      [
        700.0,
        0.42759113220297085
      ],
      [
        720.0,
        0.42127506795197545
      ],
      [
        740.0,
        0.4602368810600313
      ],
      [
        760.0,
        0.4424592464336413
      ],
      [
        780.0,
        0.4315771621440822
      ],
      [
        800.0,
        0.4417097281744321
      ],
      [
        820.0,
        0.4218319688683162
      ],
      [
        840.0,
        0.434165398200263
      ],
      [
        860.0,
        0.47003614322531395
      ],
      [
        880.0,
        0.42947876902113596
      ],
      [
        900.0,
        0.4337806425917424
      ],
      [
        920.0,
        0.40267212585444473
      ],
      [
        940.0,
        0.4494669058494052
      ],
      [
        960.0,
        0.44386024854210704
      ],
      [
        980.0,
        0.44654311559802823
      ],
      [
        1000.0,
        0.45461287337283224
      ],
      [
        1020.0,
        0.4803389307614354
      ],
      [
        1040.0,
        0.44234986263759635
      ],
      [
        1060.0,
        0.4547976240316747
      ],
      [
        1080.0,
        0.44389474508059995
      ],
      [
        1100.0,
        0.44702229556250983
      ],
      [
        1120.0,
        0.4465536456917331
      ],
      [
        1140.0,
        0.469685573423005
      ],
      [
        1160.0,
        0.4182556713291206
      ],
      [
        1180.0,
        0.4676945648502575
      ],
      [
        1200.0,
        0.4697352027725565
      ],
      [
        1220.0,
        0.43674255849879595
      ],
      [
        1240.0,
        0.4457981953163736
      ],
      [
        1260.0,
        0.43427231179874004
      ],
      [
        1280.0,
        0.44072161364460927
      ],
      [
        1300.0,
        0.4514560541846235
      ],
      [
        1320.0,
        0.42568208677183744
      ],
      [
        1340.0,
        0.48819729406487067
      ],
      [
        1360.0,
        0.4334612175401885
      ],
      [
        1380.0,
        0.4640838750075762
      ],
      [
        1400.0,
        0.4395903602490323
      ],
      [
        1420.0,
        0.43464565092449964
      ],
      [
        1440.0,
        0.4339177207005911
      ],
      [
        1460.0,
        0.44493039719520927
      ],
      [
        1480.0,
        0.445798912873736
      ],
      [
        1500.0,
        0.45695358161761696
      ],
      [
        1520.0,
        0.5951698096882345
      ],
      [
        1540.0,
        0.8125634454208567
      ],
      [
        1560.0,
        0.9422440889773226
      ],
      [
        1580.0,
        1.1381030865964912
      ],
      [
        1600.0,
        1.3019009144793812
      ],
      [
        1620.0,
        1.5145617438973322
      ],
      [
        1640.0,
        1.6618111556465143
      ],
      [
        1660.0,
        1.8313008280459608
      ],
      [
        1680.0,
        2.0565893354737548
      ],
      [
        1700.0,
        2.1075287520865253
      ],
      [
        1720.0,
        2.0961702263207767
      ],
      [
        1740.0,
        2.097467301169244
      ],
      [
        1760.0,
        2.1298900056626895
      ],
      [
        1780.0,
        2.1567728292087507
      ],
      [
        1800.0,
        2.1198460503388814
      ],
      [
        1820.0,
        2.1028518802875107
      ],
      [
        1840.0,
        2.1739938255533096
      ],
      [
        1860.0,
        2.214938050004721
      ],
      [
        1880.0,
        2.2043556012436873
      ],
      [
        1900.0,
        2.255305756638452
      ],
      [
        1920.0,
        2.1976379860525683
      ],
      [
        1940.0,
        2.2190349375782144
      ],
      [
        1960.0,
        2.237100570786676
      ],
      [
        1980.0,
        2.2355820841812326
      ],
      [
        2000.0,
        2.2366321929545414
      ],
      [
        2020.0,
        2.2542461584963394
      ],
      [
        2040.0,
        2.194602566091048
      ],
      [
        2060.0,
        2.2265491184560258
      ],
      [
        2080.0,
        2.176952327589589
      ],
      [
        2100.0,
        2.2252945402655464
      ],
      [
        2120.0,
        2.1135360874440425
      ],
      [
        2140.0,
        2.129790837755425
      ],
      [
        2160.0,
        2.1168681997595535
      ],
      [
        2180.0,
        2.130165070085456
      ],
      [
        2200.0,
        2.1413972786545035
      ],
      [
        2220.0,
        2.1075843466494346
      ],
      [
        2240.0,
        2.0868266754828135
      ],
      [
        2260.0,
        2.08736038809089
      ],
      [
        2280.0,
        2.14661266264897
      ],
      [
        2300.0,
        2.108847706489105
      ],
      [
        2320.0,
        2.077323139165493
      ],
      [
        2340.0,
        2.142950780719573
      ],
      [
        2360.0,
        2.15788430156074
      ],
      [
        2380.0,
        2.199672604944754
      ],
      [
        2400.0,
        2.200472299197725
      ],
      [
        2420.0,
        2.243005635050647
      ],
      [
        2440.0,
        2.2414755751324633
      ],
      [
        2460.0,
        2.2278094215630415
      ],
      [
        2480.0,
        2.2602145719745077
      ],
      [
        2500.0,
        2.2411024410522065
      ],
      [
        2520.0,
        2.2457038638407885
      ],
      [
        2540.0,
        2.214140544759632
      ],
      [
        2560.0,
        2.2032737000983618
      ],
      [
        2580.0,
        2.2297450396769145
      ],
      [
        2600.0,
        2.187373959403199
      ],
      [
        2620.0,
        2.1339437074670546
      ],
      [
        2640.0,
        2.1682099802568895
      ],
      [
        2660.0,
        2.1773560083892125
      ],
      [
        2680.0,
        2.157503100160022
      ],
      [
        2700.0,
        2.1020587512640065
      ],
      [
        2720.0,
        2.1014569746372875
      ],
      [
        2740.0,
        2.123789765228031
      ],
      [
        2760.0,
        2.1175680423571794
      ],
      [
        2780.0,
        2.1160409950356462
      ],
      [
        2800.0,
        2.087616967174525
      ],
      [
        2820.0,
        2.1126213096564124
      ],
      [
        2840.0,
        2.1178322407747894
      ],
      [
        2860.0,
        2.1332132559872594
      ],
      [
        2880.0,
        2.17814559459917
      ],
      [
        2900.0,
        2.187586107130717
      ],
      [
        2920.0,
        2.2034810192242102
      ],
      [
        2940.0,
        2.2474431684618357
      ],
      [
        2960.0,
        2.256164365143826
      ],
      [
        2980.0,
        2.223947162223995
      ],
      [
        3000.0,
        2.263330646397515
      ],
      [
        3020.0,
        2.233909629473378
      ],
      [
        3040.0,
        2.2509385855434316